object_id,title,featured,creator,description,source_url,period,year,object_type,subjects,source,credit,thumbnail
# Make it lower-case and avoid spaces. If you are referring to a local object please ensure the object_id matches the name of the file exactly (with or without the file extension – it doesn't matter).,# Please provide a title — this is required.,"# Mark ""yes"" to feature on homepage",,,# Here you can include a IIIF manifest and Telar will do the rest of the work for you.,,,,# Comma-separated terms for gallery filtering,"# This will be overlaid over the viewer, unless you specify otherwise in _config.yml.",,"# Telar generates thumbnails automatically, but you can override this by specifying an image file in this column."
"# Escríbelo en minúsculas y sin espacios. Si hace referencia a un objeto local, asegúrate de que el object_id coincida exactamente con el nombre del archivo (con o sin extensión; no importa).",# Incluye un título: este campo es obligatorio.,"# Marca ""sí"" para destacar en la página de inicio",,,# Aquí puedes incluir un manifiesto IIIF y Telar se encargará del resto del trabajo.,,,,# Términos separados por comas para filtrado de galería,"# Esto se mostrará encima del visor, a menos que indiques lo contrario en _config.yml.",,"# Telar genera miniaturas automáticamente, pero puedes anular este comportamiento especificando un archivo de imagen en esta columna."
telar-placeholder,Telar placeholder,yes,Adelaida Ávila,,,,2026,,,,,
master-pnp-cph-3b10000-3b15000-3b15800-3b15823u,"Chicago Electrician and Locksmith Shop, 1890s",,,,,,,,,"Library of Congress, U.S.",,
master-pnp-cph-3a50000-3a51000-3a51500-3a51565u,John Dewey photo,,,,,,,,,,,
nationalities-map-no,Nationalities Map No. 1 Nationalities Map No. 2 Nationalities Map No. 3 Nationalities Map No. 4,,,,https://www.davidrumsey.com/luna/servlet/iiif/m/RUMSEY~8~1~306909~90076812/manifest,,,,,,David Rumsey Historical Map Collection,"https://www.davidrumsey.com/luna/servlet/iiif/RUMSEY~8~1~306909~90076812/full/!96,96/0/default.jpg"
railway-terminal-guide,Railway Terminal Guide of Chicago.,,,,https://www.davidrumsey.com/luna/servlet/iiif/m/RUMSEY~8~1~37890~1210738/manifest,,,,,,David Rumsey Historical Map Collection,"https://www.davidrumsey.com/luna/servlet/iiif/RUMSEY~8~1~37890~1210738/full/!96,96/0/default.jpg"